"","index","category","title","body","sub","sub_post_id","n_comments"
"1",0,"datascience","Weekly Entering & Transitioning Thread | 15 Mar 2020 - 22 Mar 2020","_Bleep Bloop_. Welcome to this week's entering & transitioning thread! This thread is for any questions about getting started, studying, or transitioning into the data science field. Topics include:

* Learning resources (e.g. books, tutorials, videos)
* Traditional education (e.g. schools, degrees, electives)
* Alternative education (e.g. online courses, bootcamps)
* Job search questions (e.g. resumes, applying, career prospects)
* Elementary questions (e.g. where to start, what next)

While you wait for answers from the community, check out the [FAQ](https://www.reddit.com/r/datascience/wiki/frequently-asked-questions) and [Resources](https://www.reddit.com/r/datascience/wiki/resources) pages on our wiki. You can also search for [past weekly threads](https://www.reddit.com/r/datascience/search?q=weekly%20thread&restrict_sr=1&sort=new).

---

I am a bot created by the r/datascience moderators. I'm open source! You can review my [source code on GitHub](https://github.com/vogt4nick/datascience-bot).","datascience",0,2
"2",1,"datascience","What are some good Data Science master degrees in Europe","Basically, as the time says, however which degrees whose tution fees are less than 5000€/Year. I recently have been checking universities in Germany but I am curious what do you guys think


Abit of a background about me, I am 22 year Computer engineering student from Egypt, I will finish my Bachelor's degree this june, but since Data Science is not as huge as it is in the US and Europe. I thought I would get a masters degree, and save me the effort of trying to apply to jobs abroad, plus have a much stronger academic background in data science.","datascience",1,32
"3",2,"datascience","From economics to data science","So I'm about to graduate with a bachelor's degree in economics, but the last fall I developed a huge interest in data science (mainly because of econometrics) so as my classes are canceled for 2 weeks + 2 weeks of online lectures I want to dive deeper into the field of data science.

I'm in processes of creating my curriculum which I plan to follow till the end of the summer and please help me with suggestions and feedback.

**Video Courses:**

* Udemy ML A-Z (\~ 1.5 hours per day)

**Math with Textbook:**

* Linear Algebra - Youtube videos + linear algebra done right textbook (I've never taken it at my uni as it wasn't required by my major)  \~ 30 minutes per day
* ITSL textbook - (I'm comfortable with general linear models and time series which was covered through my econometrics courses) \~ 1 hour per day

**General** P**ractice:**

* Dataquest Data Scientists track (doing 1-2 missions per day) \~ 1-1.5 hours per day

What you would suggest adding/removing/replacing?","datascience",2,35
"4",3,"datascience","Kaggle M5 forecasting competition evaluation","I made a video on how to write the WRMSSE evaluation metrics into code, using a naive forecast as example. Here’s the link to it if anyone’s interested: https://youtu.be/7FwITPrBvLI

And this is the Notebook where the code is stored: https://www.kaggle.com/qcw171717/naive-baseline/

My understanding is that we are only given the level 12 series and were to infer all the information regarding higher level series. If anything in the video felt wrong to you please let me know, that would really help.","datascience",3,1
"5",4,"datascience","Modelling discount effect on sales volume","Most of my data science experience has been in the realms of NLP, recommender systems, and network analysis. I'm quite unfamiliar with using DS techniques directly for business goals; so I volunteered for a project to help me master some fundamentals. 

I have sales data for 5 products, the discount %, and the dates effective. Assume that there are many, many rows covering every product, the month effective, and the discount percentage.

For example:

    [
    (product_1, 15%, April 2019),
    (product_2, 10%, June 2019),
    (product_3, 20%, October 2019)
    ]

What are some strategies for modelling the effectiveness of discounts on products?

Because there are so many variables, I do not think that A/B testing is appropriate here. I've considered marginalizing date out, and building one  linear regression model for each product where discount is the independent var and sales volume is the dependent variable. 

However, I feel that this question is deceptively easy; perhaps it's actually an optimization problem where we're estimating the best discount price to maximize sales. For example, a $100 product might sell 4 units with 20% off and 5 units with 25% off. But without knowing the cost per item to the business, this isn't a perfect approach either. 

Thoughts?","datascience",4,0
"6",5,"datascience","COVID19 and water usage","First off, my many apologies if this is not the correct sub reddit in which to post this. I'm new at reddit. have mercy.

I was thinking that, with all the warnings due to COVID19 to wash hands at least 20 seconds, assuming a significant number of people above the norm are following that advice, there has to be an excessive amount of water usage than normal. Perhaps there are already stats on it? (My advice is to wet hands, turn water off, soap up, lather, then rinse.)

Anyway...any thoughts?","datascience",5,11
"7",6,"datascience","Need some advice for my first data science internship","My first ever data science internship starts on may this year at a big company.

I'm a CS-freshman and I'm familiar with statistics and probability theory and I've taken calculus I and II.

I have my own data science project that I created with python. I have some experience with cleaning and munging one dataset from Kaggle. I'm only familiar with linear and logistic regression when it comes to machine learning.

I have no practical experience with SQL and I've never performed data scraping.

What are your advice on how to start preparing for my internship as data scientist trainee? Should I take some MOOC's or read some related books? If so, what are the most essential for this kind of a job?","datascience",6,1
"8",7,"datascience","What do you think about Knime?","I am a Data Science student and, for one of my courses, my professor decided to focus the exam around Knime (a not too simple ML project). For my brief, albeit intense, experience, I have loathed it: it is not particularly efficient, crashes way too many times and lacks some functionality, for which I have to resort to use Python nodes. 

But maybe I am wrong and, coming from a purely Python and C++ background, I cannot see the benefits. If some of you, more experiences than me, could share their experience, maybe I could reevaluate my views. Cheers.","datascience",7,2
"9",8,"datascience","Sharing a Data Scientist Interview Case Study","","datascience",8,0
"10",82,"datascience","It’s never too early","","datascience",82,55
"11",99,"datascience","Resources for learning about Data Management/Governance? DMBOK?","Hi,

I'm changing industry to a Data Management/Governance role with no prior experience in MDM or DG

Ive been looking at resources online, books, podcasts etc. To see what I can learn before I start my new role. 

Ive stumbled across the DAMA-DMBOK book, and was wondering if anybody had read it and would they recommend it? I see it referred to as the  ""bible"" for DG

Or are there other things that I should be looking at?

Apologies if this is the wrong subreddit & thanks for your time!","datascience",99,4
"12",100,"DataScienceJobs","[Hiring] Machine Learning Engineer in Zug, Zug, Switzerland","","datasciencejobs",0,0
"13",9,"datascience","Open COVID-19 Dataset","I was frustrated with the maintenance issues in the dataset maintained by [Johns Hopkins University](https://github.com/CSSEGISandData/COVID-19) so I created an alternative crowd-sourced dataset here: https://github.com/open-covid-19/data

The data is committed directly to the repo in time-series format as a CSV file, then it gets aggregated and pushed automatically in CSV and JSON formats.

If anyone knows of any better datasets, please point them out! worldometers.info appears to have pretty good data but I can't find how to get it for my own analysis.

Edit: the dataset has changed a bit since I first posted this, now I just take the ECDC data from [their portal](https://www.ecdc.europa.eu/en/publications-data/download-todays-data-geographic-distribution-covid-19-cases-worldwide), aggregate it, and add country-level coordinates for each datapoint.

Edit 2: if you want to play with the data, you can load the sample Notebooks directly from Google Colab here: https://colab.research.google.com/github/open-covid-19/data/

Edit 3: I have renamed the dataset from ""aggregate.csv"" / ""aggregate.json"" to ""world.csv"" / ""world.json"". Sorry for the breaking change, I will try not to make any other breaking changes moving forward.","datascience",9,77
"14",10,"datascience","Is there a website like leetcode but for data scientist?","Hi as you all know leetcode is a website for software engineers where they have interview questions from Fang and can practice their skills. Is there a similar website for data scientist","datascience",10,10
"15",11,"datascience","which field in data science has the most scope and is highly paid?","","datascience",11,5
"16",12,"datascience","Question about ARIMA and VAR modelling","Dear readers,

I'm currently in my last year in Computer science, for a last project we must apply an ARIMA and a VAR model on our received data.

We have 21 data points for 200+ companies with 3 variables of intrest, my question was is it even possible to make such models? 

The goal of the model is to do forecasting. The only examples I have found about these models applied is with simple time data (which would be good for us, if we only had one company and not 200).

Sorry if it's abit vague","datascience",12,4
"17",13,"datascience","Need a dataset for a research topic. [Ideas Request]","I have a project for my MS in Data Analytics and I cant come up with a topic for the life of me.  Biggest kicker is it cant be too massive because I really only have a month to work on this, which in reality is probably 40 hours.  Im hoping for a simple enough multiple linear regression, random forest, or logistic regression. Could also be anova type analysis.  Could be anything really I just dont want to go into anything too fancy that will take 80+ hours.

I have to be able to come up with some business use case for this research, but I can probably come up with that for anything.  Ultimately it just has to be useful.

I wanted to analyze gender pay gap... but cant find find anything with # of children or number of years in the workforce or really anything significant to work off of on an individual basis.

Then I wanted to do child abuse, but the datasets are insane.. like 10000 fields insane... and you are aupposed to use fancy weights and software because of the study design.  So thats out.

Other topics that arent allowed are employee attrition, customer churn, and most banking/credit topics.  

Thanks!","datascience",13,3
"18",14,"datascience","Is there something like Project Euler but for machine learning specifically?","Hello all, I've really enjoyed solving the problems on https://projecteuler.net/ recently for personal pleasure and to learn more about mathematics/algorithms. 

For those unfamiliar with Project Euler it has many different mathematical problems many of which are unsolvable by brute force with a programming language. It forces you to think about things in the most efficient way possible and find solutions which are not obvious at first. After you solve the problem you can view a forum thread for that specific problem in which other people post their code for their solutions. It's a lot of fun seeing how your algorithm compares to others and learning ways which your algorithm can be improved. 

I was just wondering if something similar to this exists for machine learning specifically? I'm hoping to try out some different machine learning models in a non-competitive relaxed environment and also have ability to see how others solved the same problem. It would also be great if my progress was tracked and there are achievements (Just like Project Euler!).","datascience",14,20
"19",15,"datascience","Is it a bad idea to try to predict the stock market with linear regression?"," Reasons being the underlying theoretical function that generates the stock price is constantly changing due to human behavior so your model will only be accurate for a short amount of time, unlike the relation of height vs age where the fluctuation is limited by biological restrictions.","datascience",15,20
"20",16,"datascience","r/LearnCybersecurity (New Subreddit)","","datascience",16,0
"21",17,"datascience","Identifying Bot Commenters on Reddit using Benford's Law","","datascience",17,3
"22",18,"datascience","Are there laws like the three laws of robotics to help Data-Scientists govern their behaviour?","I realise the topic is complex and can easily lead to (over) simplification. But something like:

First law: Information about people shall not be used to harm individuals or groups. Neither through active use, nor through inactivity. 

Second law: Information about people shall not be stored without them being aware of it? 

Third law: Information about people shall not be transferred without them being aware of it?","datascience",18,3
"23",19,"datascience","Thinkpad T430 vs X1 Carbon 7"," 

Thoughts on:

Thinkpad T430: i7-3840QM 4 cores, 16gb ram, nvs5400m, 1080p AND X1 Carbon 7: i7-10710U 6 cores, 16gb ram, 1080p ?

I will be using the laptop for prototyping ML and Data Analysis using Python and PowerBi.

Thank you","datascience",19,7
"24",20,"datascience","How do you create your own Data Science blog","I’ve wanted to create my own blog for some time. I intend to create posts about what I’m currently busy in Data Science, as algorithms, datasets, etc.

The thing is that I’m pretty good when it’s come to programming and algorithms but I have no clue how to set up a blog. Most websites out there just explain how to do a « normal » blog but I’d like to know if there exists a way to easily create a blog where I can add codes, dynamic images, codes again, etc.

What kind of blog do you use for your Data Science activities?","datascience",20,3
"25",94,"datascience","Does anyone have the data for the average age of deaths from the recent outbreak?","(The other flairs would not work)

I see all types of data but not this (I dont need any rate of anything just this data) I appreciate your help if you could.

Im referring to Come Open Virus Identify Data nine teen 

(I asked the same question in askreddit but it was immediately downvote out of sight for reason I dont understand so im hoping not saying he who should not be name will give me better chance)

Thank you.","datascience",94,2
"26",101,"DataScienceJobs","[Hiring] Data Scientist/Senior Data Scientist – Defence & Security in London, United Kingdom","","datasciencejobs",1,0
"27",21,"datascience","Data science in Recessionary periods","Some professions in some sectors do OK during recessionary periods. 

- For example if you're an engineer working for a public utility company delivering water and power (because people always need water and electricity). 

- People in healthcare industries also do OK (people always get sick). 

- If you work for a bank, as long as you're front office (revenue generating) and not middle office or back office (cost centers), your jobs will be save.

**What about data scientists?**

We know the recession is coming and it will be pretty bad. Central banks have run out of ammo since interest rates are so low. The only cheap tricks they have is doing QE's so we don't know how long this recession will last. Learning from Japan, it's highly possible we will go bad for a really long time. 

Since data science as a profession is a new thing and since most of the time data scientists is non-revenue generating, what do you guys think will happen in this upcoming recession/depression?

What are your takes on the following professions in different industries:

- data scientists (R&D)

- data engineers

- data analysts (aka: data scientists type A, or FAANG type data scientists)

- BI

- machine learning engineers

I can start: 

If you're any of the above within healthcare, you will surely be OK (data scientists have worked in healthcare sectors for a long time, and they're called statisticians). If you're in retail, perhaps you better have enough emergency funds.

**Edit:** I'd like to take the discussion a step further. An organization will keep you around as long as your value is greater than your costs. 

So my next question is:**What would you need in terms of skills, knowledge, ability, etc so that your value is higher than your costs (so that your organization will keep you)?**","datascience",21,21
"28",22,"datascience","Creating a discord channel for those interested in becoming a data analyst. Will do weekly data visualisation projects with peer to peer code reviews.","","datascience",22,92
"29",23,"datascience","What is the recommended partition size for linux?","Hi, I want to set up a Ubuntu Linux virtual machine via Parallels Desktop for Mac. What is the recommended partition size for doing Data Science work?","datascience",23,5
"30",24,"datascience","Data science and the Corona virus","Do you guys know of any project/s that needs help with data science or software development that can help in any way with the Corona virus?","datascience",24,16
"31",25,"datascience","How do you quantify fun in games?","I am working on a personal assignment where I am trying to bucket casual games on app store in a 3x3 matrix of fun vs profitability. Profitability could be divided into high, medium, low, based on ads served on the game, and in-game purchases. But how would you quantify fun? I guess how engaging the game is would decide how fun the game is, but would it be as simple as dividing it into high-medium-low, same as profitability?

Waiting eagerly for your thoughts.","datascience",25,7
"32",26,"datascience","NVIDIA's GTC 2020 - The World's Biggest AI & Deep Learning Conference - Best of all, registration for GTC Digital is free*","","datascience",26,2
"33",27,"datascience","Australian Career Guide advice","Australian currently studying CS & DS at UWA (Perth). Had a horrible first 2 years (5 subjects failed, horrible WAM & GPA) due to personal problems and now taking an extra year to graduate. Thinking of doing a Masters of Data Science program at either Monash or USyd. 

Was wondering whether this is a bad career option? Would it be better for me to go for a grad position for a few years then do my Masters?

I’m also really new to the idea of Machine learning and careers of that sort. If I want to pursue a ML eng career, would it be a requirement to have a SWE background? 

I’m overall not 100% sure how to pursue this career path and choose a proper Big Data job, as I’ve read most companies parade many jobs as Data Science. Also things in Australia could be very different to the US, so I was wondering if anyone else had anymore tips specifically for Australians.","datascience",27,3
"34",28,"datascience","An example of why communication skills matter more than technical skills","By using simple stats, nice charts and good story telling this guy has probably helped the fight against Coronavirus more that Google with its Deepmind https://medium.com/@tomaspueyo/coronavirus-act-today-or-people-will-die-f4d3d9cd99ca","datascience",28,17
"35",29,"datascience","Plotting with Python - Matplotlib OOP interface - any good guides to this?","

I'm looking for a decent guide on using Matplotlib with the OOP interface,
and the only issue is that as i've not really used it much previously, and
some tutorials seem to be a mixture of the ""matlab"" style and OOP style.

Pretty simple request - but if anyone who uses Matplotlib regularly with OOP
syntax could suggest a decent tutorial to go through that'd be appreciated.","datascience",29,12
"36",30,"datascience","Day in the Life of a Data Analyst [video]","Follow me for a day in my life as a Data Analyst! I know this is the Data Science subreddit. I am actually on my Data Science team at work and do some Data Science work, but have the title of Data Analyst. I have been meaning to make this video for a while so I’m glad to finally have it finished. Hope you enjoy it! 

Link:
https://youtu.be/qzZU6LAtIig","datascience",30,0
"37",31,"datascience","Ten Research Challenge Areas in Data Science","","datascience",31,0
"38",32,"datascience","Searching for a data/process/workflow 3D visualization tool with ability to connect with a database","Hello there,

as title says is there a visualization tool in 3D space which for workflows or processes which I can connect to databases (like oracle)?","datascience",32,6
"39",33,"datascience","[Survey] What Data Science course do you want to learn next?","Hi again - I am taking a quick 30 sec. survey from a random sample set of data science learners to understand their learning expectations. 

If you are interested, please feel free to fill your choice of course and also pl. feel free to circulate within your group/network. (survey is not mandatory - Pl. fill only if you are interested). 

Thanks in advance for your feedback!

[https://docs.google.com/forms/d/1wRmmrlIyanpwxbb0-heheI-vCGV4LyMXnapm\_9DgOvI](https://docs.google.com/forms/d/1wRmmrlIyanpwxbb0-heheI-vCGV4LyMXnapm_9DgOvI/edit)","datascience",33,0
"40",34,"datascience","Please give some tips on HireVue Interview.","I have a HireVue Interview which I am planning to attempt on Monday. Any tips or suggestions would be highly appreciated. Please share your experience.","datascience",34,2
"41",35,"datascience","Are there benchmarks for the tf-idf statistic?","","datascience",35,0
"42",95,"datascience","Recommendations for a good course that involves using python?","Hi I am looking to complete a data science course that uses python and not R. I know the JHU courserea certification is popular but the problem is it uses R. Is there a similar certification or course that uses python and is highly recommend or valuable like the JHU certification. Thanks for reading looking forward to your replies!!","datascience",95,2
"43",126,"DataScienceJobs","[Hiring] Data Quality Specialist in Singapore, Singapore","","datasciencejobs",26,0
"44",36,"datascience","How would you preprocess features like these?","The label is a probability that an event will happen and the features are past events that could or not be correlated to the label. A huge number of zeros in the features is due to filling NANs with 0. My goal here is more or less understand those dispersions and if I should remove or filter those data points for a regressor to perform well.

The data is highly imbalanced, with many more labels equal to zero than not, but still is a honest representation of reality.

Any ideas or important steps to take given the number of zeros, imbalance or distribution will help.

&#x200B;

https://preview.redd.it/mf7i2zrwvjm41.png?width=1416&format=png&auto=webp&s=e0c68503f6a56e2d52b7a122b13efd3fcb0747a1

https://preview.redd.it/yis0myhwvjm41.png?width=1416&format=png&auto=webp&s=10c9d50d4a0ad12dec163978300f82985b8188f9

https://preview.redd.it/a2g4u1awvjm41.png?width=1378&format=png&auto=webp&s=2d4ed7927214f1fafa5300c1196859b4dadfa35a

https://preview.redd.it/9wzdkyyvvjm41.png?width=1374&format=png&auto=webp&s=47b76af6dd50f3feec52b249b8353d33941ac19b","datascience",36,2
"45",37,"datascience","Validation/test set confusion","I just finished up coding a Nueral Network for a project and I am having some confusion. I have a 3 segmented partition {train, validation, test/hold-out.

How should I be using my validation set exactly? I thought I should be using this as a stopping criteria for training...and then use the test set to get a predictive accuracy. Or should I be using validation set to tune number of nodes/layers after allowing the model to fit with the training data alone? 

I have been reading a lot on this today and Hve thoroughly confused myself.","datascience",37,1
"46",38,"datascience","Companies: All Your Data Are Belong to Us","","datascience",38,0
"47",39,"datascience","List something you 've learned on the job","Can you guys list something you learned on the job but not during your BSc, MSc or PhD (education in general)? I am curious to see what industry ""does"" to data scientists.

I ll start first:

1. Accuracy of the model has to be reasonable but don't spend too much time iterating. Shipping it on time is more important
2. I spend more time cleaning / prepping data than training models","datascience",39,13
"48",40,"datascience","Created my first time series chart using Plotly with foreign exchange dataset. Dataset obtained from Kaggle","","datascience",40,21
"49",41,"datascience","Eat the News: Extract Article Text from News Feeds Around the Globe","","datascience",41,0
